{
  "schemaVersion": 2,
  "id": "explorer",
  "description": "Perform bounded, read-heavy repository or evidence exploration.",
  "requirements": {
    "capabilityTier": "efficient",
    "reasoningEffort": "low",
    "modalities": ["text"],
    "minimumContextTokens": 64000,
    "controls": {
      "modelRouting": "preferred",
      "reasoningEffort": "preferred",
      "contextInheritance": "required",
      "contextMinimization": "required",
      "actionAuthority": "required",
      "humanApproval": "preferred",
      "auditEvidence": "preferred",
      "readOnly": "required",
      "delegationDepth": "preferred",
      "outputTokenLimit": "preferred"
    }
  },
  "governance": {
    "riskTier": "low",
    "maximumDataClassification": "internal",
    "actionAuthority": "observe",
    "humanApprovalRequiredFor": ["scope-expansion", "access-to-confidential-data"]
  },
  "execution": { "readOnly": true, "allowDelegation": false, "maxParallelism": 1 },
  "context": {
    "inheritance": "none",
    "include": ["task-goal", "search-scope", "selected-files", "applicable-canonical-guidance"],
    "exclude": ["parent-transcript", "unrelated-files", "raw-tool-output"]
  },
  "output": { "format": "findings-with-evidence-locations", "maxTokens": 4000 },
  "escalationProfile": "reviewer"
}
